id,Title,Content,Permalink,Post Type
22,Bot traffic,"
What's a Bot?



In terms of affiliate marketing, a bot is an automatic user (not a real visitor) that generates traffic. There are 2 types of bots:




good bots (like those from Google or Facebook) which simply check your campaign whether it is up to the rules or not. For good bots RedTrack has soft filters, i.e. those bots are still able to go through your campaign but you do not see them in your statistics.



bad bots which can cause a lot of problems for affiliates as this traffic never converts but spends your traffic source and tracker budget. For bad bots RedTrack introduced a bot blacklist feature.




Good bots



Not always ""Bot"" means bad clicks. There are a lot of good and friendly bots who simply check your campaigns to make sure they are safe for real visitors.&nbsp;Still, they generate automated clicks that may screw up your reports.



With RedTrack there is a good solution: you can simply filter those good bots from your reports. They will still be able to check your campaigns but you will not see those clicks in your statistics.



To enable this feature go to burger menu → Settings → General → enable the toggle Remove known (by user agent) bots/crawlers from data → Save changes:







 
Bad bots: blacklist



Bot blacklist feature works with a redirect tracking option only:



To add a bot rule to RedTrack, act as follows:



1. On the main RedTrack menu navigate to Tools→ Blacklist bots→ New:







 2. Fill in the needed fields→ Save:







Fields explained:1. Give your rule a name2. Add values to either IP addresses/IP ranges or User agent field(optional) 3. Give a small description note to your rule. This field is not mandatory.4. Press Save to apply the changes



Once enabled, traffic sent to your campaigns will be filtered based on the bot rules: bots will be excluded from the campaign report. Blocked traffic will not be counted towards your RedTrack events limit.



Ways of spotting a bot



There are 2 ways (methods) to spot a bot with RedTrack: via a Bot trap and Reports (IP or UA) :





This method does not require programming skills. You need to analyze your click logs and reports. Since in real conditions the same visitor cannot click on the same offer too many times, this method can be considered quite reliable.



This may take some time as this kind of report is taken directly from the backend and usually contains a lot of unique parameters.



1. Go to reports→ filter the data by either User agent or IP depending on the report:




If you want to analyze the data by UA (User agent) go to Campaigns→ choose the needed campaign and dive into report→ filter the data by User Agent:













If you want to analyze the data by IP go to Reports→ IP report:








2. The clicks are grouped by the set parameter. On the screen below you see that one IP has got a lot of clicks, which is pretty unusual, as, in real conditions, the live unique visitor will not click on the same campaign link that many times (it depends on your ad of course but in general they won't).&nbsp;Now you can identify bad IPs (IP ranges) and then block them:







You will need to block an IP range for the cases when the suspicious IP in your report ends with 0. That means this IP was hidden due to privacy policy. But the IP range can still be blocked. This will be something like: 69.208.0.0-69.208.0.255. The first ends with 0, the last one with 255. Take the IP from the report you want to block: 46.216.64.0. The range for this IP will be: 46.216.64.0-46.216.64.255





This method works best with landing page campaigns. In general, you will need to have access to the page code.



There are almost no traffic sources that are free of bot traffic. But it becomes a serious problem when the % of fake traffic reaches a high level, as a result, campaign optimization is very complicated. Bot trap is not a 100% reliable method of detection, some advanced bots can pass, but the majority have a very primitive structure.



Since RedTrack allows you to track multi-offer landing pages, you can add an offer for bots in your campaign, so the bot traffic can be filtered after.



To implement this method act as follows:



1. Create 2 offers: a blank offer for bots and your real offer for your product (or several offers).2. Create a Campaign.3. Put an “invisible” clickable link on your landing page.



The link:▸should contain https://your.domain.com/click/1 – it sends the bot click to offer 1 (the bot detection offer).▸can be 1×1 pixel image, the text of the same (or very similar) colour as the background.▸should be placed very low on the page.This link is not visible to real visitors, but almost every type of Bot can click on it. So whenever you see clicks to our offer 1, you know that visitors are not real, it's from bots.



4. Add other multi-offer links to your landing page. For example, in our case, it is https://your.domain.com/click/2 – it sends real visitors to offer 2 (a real offer).5. After that, you can check your campaign reports and see what IPs (or UAs) have clicked on the trap offer and block them.



Check out the article Tracking listicles (multi-offer landing page) for more information on the correct landing page setup.


",https://help.redtrack.io/knowledgebase/kb/basic-setup-9785/traffic-channel-9874/bot-blacklist/,docs
24,Cost/Ad spend: general,"
What's ad spend/campaign cost?



Campaign Cost (cost model) defines the cost of traffic you buy. CPM/CPC is good for most media-buying campaigns across Google, FB, etc. CPA/Revshare is good for affiliate/partner campaigns and CPA ad networks. 



With RedTrack, you have 2 ways of tracking the cost data:



1. Statically by adding the cost data to the tracking link or directly per campaign.



2. Dynamically: via the macro or with the help of the API for those traffic channels that support it.







This is the most obvious and simple way. You set the cost value per campaign in the campaign settings. Once the click/conversion comes, the cost is recorded automatically based on the cost model chosen:







Campaign cost models explaned:




CPC - the cost per each click.



CPA - the cost per conversion.



CPM / PopCPM - the cost for 1000 impressions, and it will not work for clicks.



RevShare - the % from each conversion revenue.



Do not track - no costs will be recorded.




Do Not Track cost model is designed for non-API integrated traffic channels. If you prefer not to receive ad spend data, switch off the ""Auto update costs"" toggle within your campaign settings:





You can set it up dynamically via the Macro or with the help of the API for those traffic channels that support it.



API



This type of integration is available for the integrated/automated traffic channels.



1. Check if your traffic channel is eligible for the API cost update.



2. Follow this guide to help you enable the Auto update cost feature. 



Auto-cost update feature will not work for CPM/CPA/Revshare campaigns.



Macro



If your traffic channel does not support the API cost update, you can try to do this with the help of the macro. This option works for the cases where the traffic channel you work with has the macro for the cost (bid, etc.).



Follow this guide for more info on the matter. 







Depending on your needs, you may set the customised campaign costs related to the additional values received for each clickid (subs, country, etc.). To do that within the added Campaign settings go to the tab Custom payouts → choose the needed payout type → add the values for your payouts → Save changes to the Custom payouts tab and the to the main campaign window:



CPA cost model custom payout sums should be represented by the fixed payout value.Revshare cost model custom payout sums should be represented by the percentage.The exception is the Hybrid cost model where:- if the cost model is CPA, the custom payout sum should be represented by the percentage- if the cost model is Revshare the custom payout sum should be represented by the fixed payout value.







Payout types explained:




GEO– set different payout based on click location.



GEO/OS&nbsp;– OS (without versions), Geo and payout amount separated by a comma with no spaces.



HYBRID&nbsp;– define conversion type to force change them to CPA (this could be helpful if you work with RevShare but want a CPA model for some conversion types).



CONVERSION SUBS&nbsp;– subid you receive with the conversion (sub1, sub2. etc.), sub value, and payout amount separated by a comma with no spaces.



TYPE/GEO/CONVSUB&nbsp;– conversion type, geo, subid you receive with the conversion, sub value, and payout amount separated by a comma with no spaces.



TYPE/CONVSUB – conversion type, subid you receive with the conversion and payout amount separated by a comma with no spaces. 




Conversion sub-parameters are the additional parameters you send with the conversion to enrich the data. They differ from click subs parameters string.



All other publisher-related options are to be used only in that case.


",https://help.redtrack.io/knowledgebase/kb/cost-tracking/cost-tracking/,docs
26,Payout/Revenue sync,"
Payout is the amount you get paid for the conversion.



With RedTrack you can track your conversions in 2 different ways: dynamically and statically. Act as per your choice:





This method offers you an effective and accurate method of tracking using a dynamic payout token or fixed value in your S2S postback URL or tracking pixel. If your affiliate network supports a dynamic payout token, it will send it back to RedTrack via your postback URL / pixel for each registered conversion via our supported&nbsp;{sum}&nbsp;parameter. 




Networks that have a preset template in RedTrack already have all the needed parameters added.





To add this parameter for the network from scratch go to Offer source → Postback parameters → place the payout tracking macro from your network into the SUM field:








The parameter will vary for each particular network, so please contact your Account manager for the correct one.



Here are some examples of postback URLs with dynamic tokens:▸ Everflow PB URL example: http://yourtrackingdomain?clickid={sub1}&amp;sum={payout_amount}▸ Affise PB URL example: http://rdtrck2.com/postback?clickid={sub1}&amp;sum={sum}▸ HasOffers PB URL example: http://rdtrck2.com/postback?clickid={aff_sub}&amp;sum={payout}▸ CAKE PB URL example: http://rdtrck2.com/postback?clickid=#s2#&amp;sum=#price#





This provides you with an alternative solution if dynamic payout macros aren’t supported by your affiliate network (or advertiser). You can record payout by using a fixed payout value in the offer settings. To set it up go to Offers → Main tab → set the payout value per each registered conversion in the Default conversion revenue field:






",https://help.redtrack.io/knowledgebase/kb/conversion-tracking/payout_tracking/,docs
28,Impressions,"
By impressions is meant the number of times your banner ad is viewed. When used with other tracking metrics, impressions give you a vital overview of your ad campaign performance: where you have more impressions and fewer click-throughs, or vice versa.



To use impression tracking, your traffic channel should support this option. Clarify it with your account manager.



Working with Impression URLs



1. Once you've created and saved the Campaign in RedTrack a Click URL (campaign link) and Impression URL are generated automatically. Copy both links and paste them to your traffic channel:











2. You will see the counted Impressions in a separate column of your Campaign report:









With RedTrack, in addition to impression tracking, you can now track visible impressions. While an ‘impression’ is&nbsp;counted every time a user&nbsp;loads a page with an impression pixel on it, a ‘Visible impression’ is counted even when a user had at least 50% of the ads on his screen for at least 1 second. It means now you have even more precise reports on how many ad impressions bring you clicks and conversions in the end.



Not all traffic channels support impression tracking, so check it first before activating impression tracking. RedTrack has integrated ad serving capabilities to ensure that visible impressions are actually visible. Please reach out to support@redtrack.io for details.



Visible impressions&nbsp; have a separate tracking URL and a separate column in reports:













This pixel can be placed on the page to track page impressions (page loads):






",https://help.redtrack.io/knowledgebase/kb/conversion-tracking/tracking-impressions/,docs
34,No redirect / redirectless tracking,"
What is no redirect tracking?



No redirect tracking method is the opposite of the redirect method. The principle of work comes from the name: there is no redirect from one link to another in the funnel. This tracking method is the only one accepted by such giants as Facebook, Google, and Bing. In simple words, it is when you use your landing page link or the direct link to your website for tracking, so the traffic goes directly to the target page without any additional redirects. The no redirect campaign is created&nbsp;the same way as the usual one, but you use your landing page/website URL instead of the campaign link.



In RedTrack, no redirect tracking can be implemented in 2 ways: via Universal tracking script + Tracking parameters (aka UTMs) or via No redirect script + Tracking parameters.



Universal tracking script vs no redirect script



ScenarioUniversal tracking scriptNo redirect scriptCan be used by affiliatesyesyesCan be used by advertisersyesyes (limited functionality)Can be used for e-comyesnoOrganic traffic trackingyes, separatelyyes, under the same campaignSeveral campaigns per LP/websiteyesnoSeveral traffic channels per LP/websiteyesno1st party cookieyesyesLP viewsyesyesLP clicksyesyesOnly offer campaignsyesno



To sum it up:




If you are an affiliate marketer working with a couple of traffic channels and use different landing pages in your funnels, the no redirect script will be an easy and smooth option to implement.



For advertisers and e-commerce shop owners, the universal tracking script is the best solution.




Important!Any RedTrack scripts must be added at the end of the body section. Otherwise, they might fail to trigger correctly.



How does it work?





This is a detailed guide on generating the universal tracking script and adjusting it according to your needs.





1. Create a Campaign and save it.



2. Tracking links and parameters → No-redirect → copy the script from your RedTrack campaign and add it to your landing page code (or website, depending on your flow):







3. To make the system work properly for the landing page click tracking, you will need to use the landing page click URL on the CTA button instead of the direct link to the offer. You can find it in the landing page edit window.











Make sure that both the script and offer click URL (your.domain.com/click) are present in the page source and have the same domain.



4. Copy the tracking parameters from your RedTrack campaign and add them to the appropriate field in the traffic channel (tracking template for Google, URL parameters for Facebook, etc.).







Some traffic channels have no separate tracking parameters field. In that case, add the parameters directly after the main URL (your landing page). Example: https://my.amazing.website.com?sub1={{ad.id}}&amp;sub2={{adset.id}}&amp;sub3={{campaign.id}}&amp;ad_name={{ad.name}}&amp;adset_name={{adset.name}}&amp;utm_source=mysource


",https://help.redtrack.io/knowledgebase/kb/conversion-tracking/no-redirect/,docs
46,Conversions: upload/update,"
If for some reason your conversions were not uploaded, RedTrack functionality allows you to upload them manually or update them as per your needs.





Before adding conversions know that:1. Once uploaded, conversions cannot be removed from your RedTrack statistics.2. Conversions in RedTrack can be uploaded via 2 options (see the steps below for details).



To upload conversions act as follows:



1. On the main RedTrack menu go to Logs → Conversions:







2. Decide on the option for the conversions upload and act on it:





Add conversions → in the pop-up window add the click ids for the missing conversions and the payouts → Save:









1. Upload → Download Template:







2. Open the downloaded .csv file → add the needed conversion click ids and the payout values for them:







3. Logs → Conversions → Upload → Upload Conversions → choose from your computer the .csv file with conversions you've created in step 2







Once the changes are saved, your conversion will appear in your conversion logs and reports.



Mind that when downloaded, the CSV file is automatically uploaded in the user's timezone, as conversions logs are always displayed in the user's timezone.Example: user’s account (GMT-4) - New York. We want to upload conversions and see their time in the logs 14:00:00. We put them in the file as 18:00:00. If the account is GMT+4, we want to see 14:00:00 in the logs, we put 10:00:00 in the file.



Make sure there are no duplicated clickids for the cases where you don't need to see duplicates in your reports. Use the most suitable option in the Duplicate postback mode section of your Offer source/Brand (Offer sources/Brands → choose the needed one among the added → scroll down to the Default duplicate postback mode section):For more info &amp; explanation on the postback modes go to this guide (How to set up conversion statuses→How to process duplicates). 







Payout



If you need to update the conversion data, it can be done the same way as a regular upload described above. The only thing you should keep in mind is that you will have to change the Duplicate postback mode in your offer source for RedTrack to update the data. To do that go to Offer sources → choose the needed one → scroll down to the Default duplicate postback mode section → select the needed mode:







Do not use Create a new conversion in this case, as it  will create a new conversion without editing the initial one.Here you can find more info on the duplicate postback modes. 



Status



To update the conversion status go to Logs → Conversions → Update status → add the click id of the conversion you need to update and choose the target status → Save:






",https://help.redtrack.io/knowledgebase/kb/conversion-tracking/conversion-upload/,docs
50,Protecting your postbacks,"
RedTrack developed 2 special features: Postback protection and Whitelist IPs that allow protecting your link from fraudulent conversions in your CPA campaigns.



To set them up follow the steps below:



Postback protection



1. Add your offer source (either from the template or a custom one).



2. In your Offer source setting enable the Postback protection toggle: 







3. Once you've enabled it, you will see the unique ptoken value is added to the Postback URL template → copy the ptoken value → save changes to the template:







4. In order to work properly, the protected postback URL with the unique ptoken should be obligatorily inserted to the offer source (affiliate network, advertiser) postback settings.



If this feature is enabled, each conversion will be checked against the uniqueness of ""ptoken"", in case it does not match, a conversion will be ignored by RedTrack.



Whitelist IP



Whitelist IP feature allows to record only certain conversions that came from a certain IP or IP range. To set it up:



1. Add your offer source (either from the template or a custom one).



2. Scroll down the template → enable the Whitelist IP toggle → paste the needed IP address → save changes to the template:







Once it's enabled, conversions with different IPs (IP ranges) will be ignored by RedTrack.
",https://help.redtrack.io/knowledgebase/kb/basic-setup-9785/offer-sources-brand-related-settings-9830/postback-protection/,docs
